Symbol,Name,Last Sale,Net Change,% Change,Market Cap,Country,IPO Year,Volume,Sector,Industry
DFHY,TrimTabs Donoghue Forlines Tactical High Yield ETF,$25.2704,-0.0646,-0.255%,,,2020,2855,,
DFIN,Donnelley Financial Solutions Inc. Common Stock ,$22.25,0.09,0.406%,742601983.00,,2016,209068,Consumer Services,Other Consumer Services
DFNS,LGL Systems Acquisition Corp. Common Stock,$10.92,0.07,0.645%,235462500.00,United States,2020,65506,Finance,Business Services
DFNV,TrimTabs Donoghue Forlines Risk Managed Innovation ETF,$27.2481,-0.6962,-2.491%,,,2020,2803,,
DFP,Flaherty & Crumrine Dynamic Preferred and Income Fund Inc. Common Stock,$29.14,-0.12,-0.41%,558665057.00,,2013,69449,,
DFPH,DFP Healthcare Acquisitions Corp. Class A Common Stock,$11.17,-0.12,-1.063%,321137500.00,United States,2020,12051,Finance,Business Services
DFPHU,DFP Healthcare Acquisitions Corp. Unit,$11.90,-0.06,-0.502%,0.00,United States,2020,5633,Finance,Business Services
DFPHW,DFP Healthcare Acquisitions Corp. Warrant,$2.688,0.388,16.87%,0.00,United States,2020,34685,Finance,Business Services
DFS,Discover Financial Services Common Stock,$95.39,1.47,1.565%,29255323362.00,United States,,2070250,Finance,Finance: Consumer Services
DG,Dollar General Corporation Common Stock,$198.77,-2.39,-1.188%,48698829489.00,United States,2009,1852726,Consumer Services,Department/Specialty Retail Stores
DGICA,Donegal Group Inc. Class A Common Stock,$13.97,-0.03,-0.214%,415914351.00,United States,,60993,Finance,Property-Casualty Insurers
DGICB,Donegal Group Inc. Class B Common Stock,$12.375,0.00,0.00%,368428067.00,United States,1986,15,Finance,Property-Casualty Insurers
DGII,Digi International Inc. Common Stock,$23.76,0.05,0.211%,705893111.00,United States,1989,135682,Technology,Computer Communications Equipment
DGLY,Digital Ally Inc. Common Stock,$2.24,-0.15,-6.276%,90655468.00,United States,,6316933,Technology,Radio And Television Broadcasting And Communications Equipment
DGNR,Dragoneer Growth Opportunities Corp. Class A Ordinary Shares,$11.78,-0.10,-0.842%,1016025000.00,United States,2020,336095,Finance,Business Services
DGNS,Dragoneer Growth Opportunities Corp. II Class A Ordinary Shares,$12.75,-0.12,-0.932%,402645000.00,United States,2020,101694,Finance,Business Services
DGX,Quest Diagnostics Incorporated Common Stock,$116.21,-3.02,-2.533%,15455930000.00,United States,,2180379,Health Care,Medical Specialities
DHC,Diversified Healthcare Trust Common Shares of Beneficial Interest,$4.43,0.075,1.722%,1055529358.00,United States,,1389890,Consumer Services,Real Estate Investment Trusts
DHCNI,Diversified Healthcare Trust 5.625% Senior Notes due 2042,$23.02,-0.35,-1.498%,0.00,United States,,20487,Consumer Services,Real Estate Investment Trusts
DHCNL,Diversified Healthcare Trust 6.25% Senior Notes Due 2046,$23.80,-0.20,-0.833%,0.00,United States,,13676,Consumer Services,Real Estate Investment Trusts
DHF,BNY Mellon High Yield Strategies Fund Common Stock,$3.08,0.02,0.654%,223939679.00,United States,1998,2961491,,
DHHCU,DiamondHead Holdings Corp. Unit,$10.78,0.02,0.186%,0.00,United States,2021,232542,Finance,Business Services
DHI,D.R. Horton Inc. Common Stock,$77.46,-1.75,-2.209%,28172334612.00,United States,,2844360,Capital Goods,Homebuilding
DHIL,Diamond Hill Investment Group Inc. Class A Common Stock,$145.75,2.05,1.427%,461046020.00,United States,,6742,Finance,Investment Managers
DHR,Danaher Corporation Common Stock,$225.50,-5.74,-2.482%,160330500000.00,United States,,3433580,Capital Goods,Industrial Machinery/Components
DHR^A,Danaher Corporation 4.75% Mandatory Convertible Preferred Stock Series A,$1542.63,-39.70,-2.509%,,United States,,1988,,
DHR^B,Danaher Corporation 5.00% Mandatory Convertible Preferred Stock Series B,$1310.16,-30.23,-2.255%,,United States,,41981,,
DHT,DHT Holdings Inc.,$5.72,-0.11,-1.887%,976966436.00,Jersey,2005,2631094,Transportation,Marine Transportation
DHX,DHI Group Inc. Common Stock,$2.98,-0.06,-1.974%,155675680.00,United States,2007,109195,Miscellaneous,Business Services
DHY,Credit Suisse High Yield Bond Fund Common Stock,$2.38,0.02,0.847%,246347617.00,United States,1998,5878207,,
DIAX,Nuveen Dow 30SM Dynamic Overwrite Fund Common Shares of Beneficial Interest,$15.29,-0.02,-0.131%,556050100.00,,2014,65685,,
DIN,Dine Brands Global Inc. Common Stock,$80.81,-0.44,-0.542%,1326799107.00,United States,,423162,Consumer Services,Restaurants
DIOD,Diodes Incorporated Common Stock,$82.83,-1.27,-1.51%,3667397149.00,United States,,599671,Technology,Semiconductors
DIS,Walt Disney Company (The) Common Stock,$191.76,8.11,4.416%,348095005272.00,United States,,18799609,Consumer Services,Services-Misc. Amusement & Recreation
DISCA,Discovery Inc. Series A Common Stock,$55.29,4.50,8.86%,27155811883.00,United States,,14043018,Consumer Services,Television Services
DISCB,Discovery Inc. Series B Common Stock,$58.19,5.49,10.417%,28580153617.00,United States,,2483,Consumer Services,Television Services
DISCK,Discovery Inc. Series C Common Stock,$46.00,3.20,7.477%,22593006812.00,United States,,5944119,Consumer Services,Television Services
DISH,DISH Network Corporation Class A Common Stock,$32.26,-1.41,-4.188%,16969033145.00,United States,1995,5090555,Consumer Services,Television Services
DIT,AMCON Distributing Company Common Stock,$117.64,8.65,7.937%,64863049.00,United States,,2620,Consumer Non-Durables,Food Distributors
DJAN,FT Cboe Vest U.S. Equity Deep Buffer ETF - January,$30.25,-0.09,-0.297%,,United States,2021,12775,,
DJCO,Daily Journal Corp. (S.C.) Common Stock,$342.05,0.74,0.217%,472284169.00,United States,,2868,Consumer Services,Newspapers/Magazines
DJUN,FT Cboe Vest U.S. Equity Deep Buffer ETF - June,$32.6464,-0.025,-0.077%,,United States,2020,1304,,
DK,Delek US Holdings Inc. Common Stock,$25.53,1.53,6.375%,1882218602.00,United States,2017,1193305,Energy,Integrated oil Companies
DKL,Delek Logistics Partners L.P. Common Units representing Limited Partner Interests,$41.32,-0.57,-1.361%,1794661435.00,United States,2012,70582,Energy,Natural Gas Distribution
DKNG,DraftKings Inc. Class A Common Stock,$60.37,-0.54,-0.887%,23647763676.00,United States,2019,10018180,Consumer Services,Services-Misc. Amusement & Recreation
DKS,Dick's Sporting Goods Inc Common Stock,$74.41,-0.23,-0.308%,6667037407.00,United States,2002,1275638,Consumer Services,Other Specialty Stores
DL,China Distance Education Holdings Limited American Depositary Shares,$9.62,-0.05,-0.517%,325445639.00,China,,87918,Consumer Services,Other Consumer Services
DLA,Delta Apparel Inc. Common Stock,$27.40,0.49,1.821%,191105684.00,United States,,19021,Consumer Non-Durables,Apparel
DLB,Dolby Laboratories Common Stock,$93.68,-0.10,-0.107%,9519102374.00,United States,2005,353108,Miscellaneous,Multi-Sector Companies
DLCAU,Deep Lake Capital Acquisition Corp. Unit,$10.71,-0.10,-0.925%,0.00,United States,2021,452841,Finance,Business Services
DLHC,DLH Holdings Corp.,$10.80,0.18,1.695%,135474185.00,United States,,21482,Technology,Professional Services
DLNG,Dynagas LNG Partners LP Common Units,$2.95,0.04,1.375%,105057111.00,Greece,,127619,Consumer Services,Marine Transportation
DLNG^A,Dynagas LNG Partners LP 9.00% Series A Cumulative Redeemable Preferred Units,$24.4442,0.0442,0.181%,,Greece,,3742,,
DLNG^B,Dynagas LNG Partners LP 8.75% Series B Fixed to Floating Rate Cumulative Redeemable Perpetual Preferred Units liquidation preference $25.00 per Uni,$21.02,-0.06,-0.285%,,Greece,,4078,,
DLPN,Dolphin Entertainment Inc. Common Stock,$5.72,-0.03,-0.522%,37525156.00,United States,,139318,Consumer Services,Other Consumer Services
DLR,Digital Realty Trust Inc. Common Stock,$137.60,1.15,0.843%,38567866298.00,United States,2004,1647264,Consumer Services,Real Estate Investment Trusts
DLR^C,Digital Realty Trust Inc. 6.625% Series C Cumulative Redeemable Perpetual Preferred Stock,$25.56,-0.1238,-0.482%,,United States,,9501,,
DLR^J,Digital Realty Trust Inc. 5.250% Series J Cumulative Redeemable Preferred Stock,$25.85,0.00,0.00%,,United States,,18069,,
DLR^K,Digital Realty Trust Inc. 5.850% Series K Cumulative Redeemable Preferred Stock par value $0.01 per share,$27.39,0.37,1.369%,,United States,,128930,,
DLR^L,Digital Realty Trust Inc. 5.200% Series L Cumulative Redeemable Preferred Stock,$26.543,-0.022,-0.083%,,United States,,24764,,
DLTH,Duluth Holdings Inc. Class B Common Stock,$14.70,0.86,6.214%,482574481.00,United States,2015,657752,Consumer Services,Clothing/Shoe/Accessory Stores
DLTR,Dollar Tree Inc. Common Stock,$104.88,-3.02,-2.799%,24666952902.00,United States,1995,2247019,Consumer Services,Department/Specialty Retail Stores
DLX,Deluxe Corporation Common Stock,$41.44,2.00,5.071%,1736086863.00,United States,,330625,Consumer Durables,Publishing
DLY,DoubleLine Yield Opportunities Fund Common Shares of Beneficial Interest,$19.35,-0.15,-0.769%,0.00,,2020,114461,,
DM,Desktop Metal Inc. Class A Common Stock,$23.98,-2.11,-8.087%,5557152130.00,,2019,4199795,Technology,Industrial Machinery/Components
DMAC,DiaMedica Therapeutics Inc. Common Stock,$9.90,-0.53,-5.081%,185516833.00,United States,2018,86589,Health Care,Major Pharmaceuticals
DMAY,FT Cboe Vest U.S. Equity Deep Buffer ETF - May,$32.93,-0.02,-0.061%,,United States,2020,416,,
DMB,BNY Mellon Municipal Bond Infrastructure Fund Inc. Common Stock,$14.31,-0.07,-0.487%,263126170.00,,2013,60114,,
DMF,BNY Mellon Municipal Income Inc. Common Stock,$8.69,-0.09,-1.025%,180324435.00,United States,1988,41646,,
DMLP,Dorchester Minerals L.P. Common Units Representing Limited Partnership Interests,$14.56,0.51,3.63%,504937509.00,United States,,105155,Energy,Oil & Gas Production
DMO,Western Asset Mortgage Opportunity Fund Inc. Common Stock,$14.67,0.23,1.593%,161136424.00,United States,2010,47562,,
DMRC,Digimarc Corporation Common Stock,$42.09,0.18,0.429%,695066852.00,United States,,75534,Technology,EDP Services
DMS,Digital Media Solutions Inc. Class A Ordinary Shares,$14.16,0.29,2.091%,826831301.00,United States,2018,114044,Miscellaneous,Business Services
DMTK,DermTech Inc. Common Stock,$75.40,-4.36,-5.466%,1916666417.00,United States,2017,2205182,Health Care,Medical Specialities
DMYD,dMY Technology Group Inc. II Class A Common Stock,$20.27,0.06,0.297%,699315000.00,United States,2020,1223856,Finance,Business Services
DMYI,dMY Technology Group Inc. III Class A Common Stock,$12.75,0.04,0.315%,483304688.00,United States,2021,506923,Finance,Business Services
DNB,Dun & Bradstreet Holdings Inc. Common Stock,$23.54,0.00,0.00%,9956295447.00,United States,2020,1790817,Finance,Finance: Consumer Services
DNK,Phoenix Tree Holdings Limited American Depositary Shares each representing ten (10) Class A ordinary shares,$2.71,-0.51,-15.839%,495604800.00,,2020,1139901,Consumer Services,Building operators
DNLI,Denali Therapeutics Inc. Common Stock,$65.71,0.43,0.659%,7879844372.00,United States,2017,918735,Health Care,Biotechnology: Biological Products (No Diagnostic Substances)
DNMR,Danimer Scientific Inc. Common Stock,$46.26,-3.10,-6.28%,3965618608.00,,2020,1542246,Basic Industries,Major Chemicals
DNN,Denison Mines Corp Ordinary Shares (Canada),$1.19,-0.01,-0.833%,807712283.00,Canada,,58128256,Basic Industries,Precious Metals
DNOV,FT Cboe Vest U.S. Equity Deep Buffer ETF - November,$33.5411,-0.0478,-0.142%,,United States,2019,5842,,
DNOW,NOW Inc. Common Stock,$10.49,1.12,11.953%,1147392287.00,,2014,1647623,Energy,Metal Fabrications
DNP,DNP Select Income Fund Inc. Common Stock,$10.57,0.08,0.763%,3269327943.00,United States,1987,627887,,
DOC,Physicians Realty Trust Common Shares of Beneficial Interest,$17.64,0.23,1.321%,3673172825.00,United States,2013,1502678,Consumer Services,Real Estate Investment Trusts
DOCT,FT Cboe Vest U.S. Equity Deep Buffer ETF - October,$31.0889,-0.053,-0.17%,,United States,2020,11,,
DOCU,DocuSign Inc. Common Stock,$243.51,-21.65,-8.165%,46572972102.00,United States,2018,4620129,Technology,Computer Software: Prepackaged Software
DOGZ,Dogness (International) Corporation Class A Common Stock,$2.48,0.08,3.333%,72834527.00,China,2017,1058154,Consumer Durables,Miscellaneous manufacturing industries
DOMO,Domo Inc. Class B Common Stock,$64.05,-5.07,-7.335%,1918250551.00,United States,2018,350075,Technology,Computer Software: Prepackaged Software
DOOO,BRP Inc. (Recreational Products) Common Subordinate Voting Shares,$71.18,-0.44,-0.614%,6258154853.00,Canada,,34144,Capital Goods,Industrial Specialties
DOOR,Masonite International Corporation Ordinary Shares (Canada),$109.25,1.57,1.458%,2676949145.00,Canada,,118459,Basic Industries,Forest Products
DORM,Dorman Products Inc. Common Stock,$102.53,9.45,10.153%,3310355043.00,United States,,322577,Capital Goods,Auto Parts:O.E.M.
DOV,Dover Corporation Common Stock,$122.14,-0.11,-0.09%,17545319029.00,United States,,1144825,Technology,Industrial Machinery/Components
DOW,Dow Inc. Common Stock ,$62.48,2.09,3.461%,46479781709.00,,2019,5672558,Basic Industries,Major Chemicals
DOX,Amdocs Limited Ordinary Shares,$77.15,0.18,0.234%,10093148750.00,Guernsey,,977095,Technology,EDP Services
DOYU,DouYu International Holdings Limited ADS,$15.05,-1.32,-8.064%,4830245578.00,China,2019,6281885,Technology,Computer Software: Programming Data Processing
DPG,Duff & Phelps Utility and Infrastructure Fund Inc.,$12.97,0.02,0.154%,491949584.00,United States,2011,182505,,
DPW,Ault Global Holdings Inc. Common Stock,$5.41,-1.34,-19.852%,150146770.00,United States,,25399842,Capital Goods,Industrial Machinery/Components
DPZ,Domino's Pizza Inc Common Stock,$365.16,-6.30,-1.696%,14387269675.00,United States,2004,768876,Consumer Non-Durables,Food Distributors
DQ,DAQO New Energy Corp. American Depositary Shares each representing five ordinary shares,$95.25,-9.55,-9.113%,6618334808.00,China,2010,2137066,Technology,Semiconductors
DRD,DRDGOLD Limited American Depositary Shares,$9.79,0.32,3.379%,837156400.00,South Africa,,450918,Basic Industries,Precious Metals
DRE,Duke Realty Corporation Common Stock,$40.67,-0.32,-0.781%,15127254125.00,United States,,1161879,Consumer Services,Real Estate Investment Trusts
DRH,Diamondrock Hospitality Company Common Stock,$9.74,-0.21,-2.111%,1943313891.00,United States,2005,3649908,Consumer Services,Real Estate Investment Trusts
DRH^A,Diamondrock Hospitality Company 8.250% Series A Cumulative Redeemable Preferred Stock,$26.99,0.09,0.335%,,United States,,9385,,
DRI,Darden Restaurants Inc. Common Stock,$135.00,0.99,0.739%,17594302545.00,United States,,1634281,Consumer Services,Restaurants
DRIO,DarioHealth Corp. Common Stock,$27.75,-0.25,-0.893%,405094500.00,Israel,,373568,Health Care,Medical/Dental Instruments
DRIOW,DarioHealth Corp. Warrant,$0.235,-0.025,-9.615%,0.00,Israel,,100680,Health Care,Medical/Dental Instruments
DRNA,Dicerna Pharmaceuticals Inc. Common Stock,$27.63,0.20,0.729%,2073490476.00,United States,2014,883409,Health Care,Major Pharmaceuticals
DRQ,Dril-Quip Inc. Common Stock,$35.44,1.43,4.205%,1243794975.00,United States,1997,129543,Energy,Metal Fabrications
DRRX,DURECT Corporation Common Stock,$2.55,0.01,0.394%,565675484.00,United States,2000,3459317,Health Care,Major Pharmaceuticals
DRTT,DIRTT Environmental Solutions Ltd. Common Shares,$2.25,-0.04,-1.747%,190533069.00,Canada,,103706,Technology,Computer Software: Prepackaged Software
DRUA,Dominion Energy Inc. 2016 Series A 5.25% Enhanced Junior Subordinated Notes due 2076,$25.32,-0.08,-0.315%,0.00,United States,2016,55659,Public Utilities,Electric Utilities: Central
DRVN,Driven Brands Holdings Inc. Common Stock,$31.23,0.34,1.101%,5228222201.00,United States,2021,314633,Consumer Services,Automotive Aftermarket
DS,Drive Shack Inc.,$2.63,-0.10,-3.663%,239953126.00,United States,,2390826,Consumer Services,Restaurants
DS^B,Drive Shack Inc. Preferred Series B,$21.70,-0.10,-0.459%,,United States,,486,,
DS^C,Drive Shack Inc. Preferred Series C,$20.30,-0.01,-0.049%,,United States,,151,,
DS^D,Drive Shack Inc. Pfd Ser D,$20.99,-0.03,-0.143%,,United States,,250,,
DSAC,Duddell Street Acquisition Corp. Class A Ordinary Shares,$10.55,-0.04,-0.378%,230781250.00,Hong Kong,2020,298902,Finance,Business Services
DSACU,Duddell Street Acquisition Corp. Unit,$11.6675,0.00,0.00%,0.00,Hong Kong,2020,77,Finance,Business Services
DSACW,Duddell Street Acquisition Corp. Warrant,$2.6001,0.2601,11.115%,0.00,Hong Kong,2020,48604,Finance,Business Services
DSE,Duff & Phelps Select MLP and Midstream Energy Fund Inc.,$6.92,0.15,2.216%,18153617.00,United States,2014,30866,,
DSEP,FT Cboe Vest U.S. Equity Deep Buffer ETF - September,$31.3048,-0.0536,-0.171%,,United States,2020,7900,,
DSGX,Descartes Systems Group Inc. (The) Common Stock,$59.83,-1.15,-1.886%,5054676823.00,Canada,,80584,Technology,Computer Software: Prepackaged Software
DSKE,Daseke Inc. Common Stock,$5.55,0.14,2.588%,360878616.00,United States,2015,405258,Consumer Services,Transportation Services
DSKEW,Daseke Inc. Warrant,$0.20,0.0128,6.838%,0.00,United States,2015,246777,Consumer Services,Transportation Services
DSL,DoubleLine Income Solutions Fund Common Shares of Beneficial Interests,$17.42,-0.15,-0.854%,1776089337.00,,2013,491031,,
DSM,BNY Mellon Strategic Municipal Bond Fund Inc. Common Stock,$7.68,-0.16,-2.041%,379557204.00,United States,1989,153408,,
DSOC,Innovator Double Stacker ETF - October,$28.5334,-0.1912,-0.666%,0.00,,2020,2562,,
DSP,Viant Technology Inc. Class A Common Stock,$65.01,-0.91,-1.38%,3831400691.00,United States,2021,220836,Technology,Computer Software: Programming Data Processing
DSPG,DSP Group Inc. Common Stock,$16.37,0.02,0.122%,386284511.00,United States,1994,108914,Technology,Semiconductors
DSS,Document Security Systems Inc. Common Stock,$4.05,-0.17,-4.028%,112064006.00,United States,,3666753,Consumer Durables,Containers/Packaging
DSSI,Diamond S Shipping Inc. Common Stock ,$8.59,0.13,1.537%,347384694.00,,2019,386442,Consumer Services,Transportation Services
DSU,Blackrock Debt Strategies Fund Inc. Common Stock,$10.79,0.06,0.559%,504791203.00,United States,1998,114953,,
DSWL,Deswell Industries Inc. Common Shares,$3.56,0.02,0.565%,56658251.00,Macau,1995,91856,Consumer Non-Durables,Plastic Products
DSX,Diana Shipping inc. common stock,$3.02,-0.10,-3.205%,251490506.00,Greece,2005,1128641,Transportation,Marine Transportation
DSX^B,Diana Shipping Inc. Perpetual Preferred Shares Series B (Marshall Islands),$25.63,0.08,0.313%,,Greece,,1796,,
DT,Dynatrace Inc. Common Stock,$50.49,-2.39,-4.52%,14268161113.00,United States,2019,2569950,Technology,Computer Software: Prepackaged Software
DTB,DTE Energy Company 2020 Series G 4.375% Junior Subordinated Debentures due 2080,$24.93,-0.01,-0.04%,0.00,United States,2020,31810,Public Utilities,Electric Utilities: Central
DTE,DTE Energy Company Common Stock,$122.15,1.97,1.639%,23643304285.00,United States,,1271576,Public Utilities,Electric Utilities: Central
DTEA,DAVIDsTEA Inc. Common Stock,$4.32,-0.45,-9.434%,113317518.00,Canada,2015,728290,Consumer Non-Durables,Food Chains
DTF,DTF Tax-Free Income Inc. Common Stock,$14.34,-0.04,-0.278%,100803976.00,United States,1991,14541,,
DTIL,Precision BioSciences Inc. Common Stock,$11.29,-0.96,-7.837%,634979620.00,United States,2019,1157033,Health Care,Biotechnology: Biological Products (No Diagnostic Substances)
DTJ,DTE Energy Company 2016 Series B 5.375% Junior Subordinated Debentures due 2076,$25.25,-0.06,-0.237%,0.00,United States,2016,17437,Public Utilities,Electric Utilities: Central
DTLA^,Brookfield DTLA Inc. 7.625% Series A Cumulative Redeemable Preferred Stock,$12.90,0.41,3.283%,,,,10595,,
DTP,DTE Energy Company 6.25% Corporate Units,$46.73,0.36,0.776%,0.00,United States,,21675,Public Utilities,Electric Utilities: Central
DTSS,Datasea Inc. Common Stock,$4.61,0.45,10.817%,98978756.00,China,,1931776,Technology,Computer Software: Prepackaged Software
DTW,DTE Energy Company 2017 Series E 5.25% Junior Subordinated Debentures due 2077,$25.75,-0.16,-0.618%,0.00,United States,2017,10878,Public Utilities,Electric Utilities: Central
DTY,DTE Energy Company 2016 Series F 6.00% Junior Subordinated Debentures due 2076,$26.19,0.00,0.00%,0.00,United States,2016,11147,Public Utilities,Electric Utilities: Central
DUC,Duff & Phelps Utility & Corporate Bond Trust Inc. Common Stock,$10.51,0.21,2.039%,288969118.00,United States,1993,127978,,
DUDE,Merlyn.AI SectorSurfer Momentum ETF,$28.75,-1.13,-3.782%,,United States,2020,49557,,
DUK,Duke Energy Corporation (Holding Company) Common Stock,$88.35,-0.08,-0.09%,65021938776.00,United States,,2981624,Public Utilities,Power Generation
DUK^A,Duke Energy Corporation Depositary Shares each representing a 1/1000th interest in a share of 5.75% Series A Cumulative Redeemable Perpetual Preferred Stock,$27.12,0.07,0.259%,,United States,,287860,Public Utilities,Power Generation
DUKB,Duke Energy Corporation 5.625% Junior Subordinated Debentures due 2078,$26.66,-0.12,-0.448%,0.00,United States,2018,64821,Public Utilities,Power Generation
DUKH,Duke Energy Corporation 5.125% Junior Subordinated Debentures due 2073,$25.32,-0.06,-0.236%,0.00,United States,,37329,Public Utilities,Power Generation
DUNE,Dune Acquisition Corporation Class A Common Stock,$10.10,-0.021,-0.207%,,United States,2021,547130,Finance,Business Services
DUNEU,Dune Acquisition Corporation Unit,$10.93,0.02,0.183%,0.00,United States,2020,358368,Finance,Business Services
DUNEW,Dune Acquisition Corporation Warrant,$1.76,0.06,3.529%,0.00,United States,2021,354598,Finance,Business Services
DUO,Fangdd Network Group Ltd. American Depositary Shares,$8.45,-0.38,-4.304%,674705156.00,China,2019,128430,Finance,Real Estate
DUOT,Duos Technologies Group Inc. Common Stock,$7.07,-0.21,-2.885%,24985486.00,United States,,38170,Technology,Computer Software: Prepackaged Software
DVA,DaVita Inc. Common Stock,$99.98,-2.09,-2.048%,10884822600.00,United States,,731161,Health Care,Misc Health and Biotechnology Services
DVAX,Dynavax Technologies Corporation Common Stock,$9.60,-0.47,-4.667%,1057659446.00,United States,2004,3728748,Health Care,Major Pharmaceuticals
DVD,Dover Motorsports Inc. Common Stock,$2.43,0.06,2.532%,88384888.00,United States,1996,48062,Consumer Services,Services-Misc. Amusement & Recreation
DVN,Devon Energy Corporation Common Stock,$21.25,0.42,2.016%,14303375000.00,United States,,19651010,Energy,Oil & Gas Production
DWIN,Delwinds Insurance Acquisition Corp. Class A Common Stock,$10.19,-0.025,-0.245%,262787363.00,,2021,259519,Finance,Business Services
DWSN,Dawson Geophysical Company Common Stock,$3.25,0.19,6.209%,76303734.00,United States,,119714,Energy,Oil & Gas Production
DX,Dynex Capital Inc. Common Stock,$18.89,0.01,0.053%,507394278.00,United States,,396882,Consumer Services,Real Estate Investment Trusts
DX^C,Dynex Capital Inc. 6.900% Series C Fixed-to-Floating Rate Cumulative Redeemable Preferred Stock,$25.22,-0.01,-0.04%,,United States,,20813,,
DXC,DXC Technology Company Common Stock ,$25.99,0.18,0.697%,6616897878.00,,,2330690,Technology,EDP Services
DXCM,DexCom Inc. Common Stock,$412.06,-6.88,-1.642%,39630844198.00,United States,2005,647108,Health Care,Medical/Dental Instruments
DXF,Dunxin Financial Holdings Limited American Depositary Shares,$1.61,-0.17,-9.551%,33608539.00,China,,234375,Finance,Finance: Consumer Services
DXPE,DXP Enterprises Inc. Common Stock,$29.68,0.79,2.735%,528028481.00,United States,,39725,Capital Goods,Industrial Machinery/Components
DXR,Daxor Corporation Common Stock,$12.30,-0.74,-5.675%,49368633.00,United States,,8884,Health Care,Medical/Dental Instruments
DXYN,Dixie Group Inc. (The) Common Stock,$5.50,0.07,1.289%,86975273.00,United States,,232242,Consumer Durables,Home Furnishings
DY,Dycom Industries Inc. Common Stock,$77.36,0.67,0.874%,2468803837.00,United States,,539894,Basic Industries,Water Supply
DYAI,Dyadic International Inc. Common Stock,$6.01,-0.01,-0.166%,165167764.00,United States,,102292,Health Care,Biotechnology: Biological Products (No Diagnostic Substances)
DYFN,Angel Oak Dynamic Financial Strategies Income Term Trust Common Shares of Beneficial Interest,$18.24,-0.1199,-0.653%,0.00,,2020,26074,,
DYN,Dyne Therapeutics Inc. Common Stock,$19.68,0.89,4.737%,1012475051.00,United States,2020,409140,Health Care,Major Pharmaceuticals
DYNT,Dynatronics Corporation Common Stock,$1.30,-0.13,-9.091%,19466860.00,United States,,733948,Health Care,Medical/Dental Instruments
DZSI,DZS Inc. Common Stock,$17.46,-0.04,-0.229%,463700393.00,United States,,160389,Public Utilities,Telecommunications Equipment
E,ENI S.p.A. Common Stock,$22.72,0.39,1.747%,40259376148.00,Italy,,525772,Energy,Oil & Gas Production
EA,Electronic Arts Inc. Common Stock,$142.26,-3.69,-2.528%,40917678601.00,United States,,1833130,Technology,Computer Software: Prepackaged Software
EACPU,Edify Acquisition Corp. Units,$10.3499,0.0199,0.193%,0.00,United States,2021,219613,Finance,Business Services
EAD,Wells Fargo Income Opportunities Fund Common Shares,$8.26,0.01,0.121%,500442128.00,United States,2003,94465,,
EAF,GrafTech International Ltd. Common Stock,$12.63,0.17,1.364%,3374632358.00,United States,2018,1816892,Energy,Industrial Machinery/Components
EAI,Entergy Arkansas LLC First Mortgage Bonds 4.875% Series Due September 1 2066,$25.61,0.05,0.196%,0.00,United States,2016,72514,Public Utilities,Electric Utilities: Central
EAR,Eargo Inc. Common Stock,$63.61,-5.42,-7.852%,2429044219.00,United States,2020,154868,Health Care,Industrial Specialties
EARN,Ellington Residential Mortgage REIT Common Shares of Beneficial Interest,$12.31,0.05,0.408%,151839369.00,United States,2013,36655,Consumer Services,Real Estate Investment Trusts
EARS,Auris Medical Holding Ltd. Common Shares 0.01 SF (Bermuda),$4.10,0.02,0.49%,29066999.00,Bermuda,2014,651050,Health Care,Major Pharmaceuticals
EAST,Eastside Distilling Inc. Common Stock,$2.16,-0.05,-2.262%,21922384.00,United States,,217005,Consumer Non-Durables,Beverages (Production/Distribution)
