Symbol,Name,Last Sale,Net Change,% Change,Market Cap,Country,IPO Year,Volume,Sector,Industry
JOFFU,JOFF Fintech Acquisition Corp. Unit,$10.7301,-0.0699,-0.647%,0.00,United States,2021,141023,Finance,Business Services
JOUT,Johnson Outdoors Inc. Class A Common Stock,$123.41,-3.15,-2.489%,1247943147.00,United States,,17920,Consumer Non-Durables,Recreational Products/Toys
JP,Jupai Holdings Limited American Depositary Shares each representing six ordinary shares,$3.23,0.09,2.866%,108897244.00,,2015,59435,Consumer Services,Other Consumer Services
JPC,Nuveen Preferred & Income Opportunities Fund,$9.18,-0.06,-0.649%,948800268.00,United States,2003,464385,,
JPI,Nuveen Preferred and Income Term Fund Common Shares of Beneficial Interest,$24.03,-0.27,-1.111%,546956226.00,,2012,60385,,
JPM,JP Morgan Chase & Co. Common Stock,$149.41,1.39,0.939%,455610854000.00,United States,,11488415,Finance,Major Banks
JPM^C,J P Morgan Chase & Co Depositary Shares each representing a 1/400th interest in a share of 6.00% Non-Cumulative  Preferred Stock Series EE,$27.00,0.01,0.037%,,United States,,251590,,
JPM^D,J P Morgan Chase & Co Depositary Shares each representing a 1/400th  interest in a share of 5.75% Non-Cumulative  Preferred Stock Series DD,$26.55,-0.08,-0.30%,,United States,,203862,,
JPM^G,J P Morgan Chase & Co Depositary Shares each representing a 1/400th interest in a share of 6.10% Non-Cumulative Preferred Stock Series AA,$25.60,0.03,0.117%,,United States,,56698,,
JPM^H,J P Morgan Chase & Co Depositary Shares each representing a 1/400th interest in a share of 6.15% Non-Cumulative Preferred Stock Series BB,$25.50,-0.02,-0.078%,,United States,,69877,Finance,Major Banks
JPM^J,J P Morgan Chase & Co Depositary Shares each representing a 1/400th interest in a share of JPMorgan Chase & Co. 4.75% Non-Cumulative Preferred Stock Series GG,$25.75,-0.13,-0.502%,,United States,,78507,Finance,Major Banks
JPS,Nuveen Preferred & Income Securities Fund,$9.50,-0.02,-0.21%,1935908746.00,United States,2002,436368,,
JPT,Nuveen Preferred and Income 2022 Term Fund Common Shares of Beneficial Interest,$24.1601,-0.2599,-1.064%,165235273.00,United States,2017,24979,,
JQC,Nuveen Credit Strategies Income Fund Shares of Beneficial Interest,$6.42,0.03,0.469%,870611642.00,United States,2003,638122,,
JRI,Nuveen Real Asset Income and Growth Fund Common Shares of Beneficial Interest,$14.14,-0.03,-0.212%,388414205.00,United States,2012,144317,,
JRJC,China Finance Online Co. Limited American Depositary Shares,$13.88,-0.66,-4.539%,33894405.00,China,2004,150555,Finance,Investment Bankers/Brokers/Service
JRO,Nuveen Floating Rate Income Opportuntiy Fund Shares of Beneficial Interest,$9.19,0.03,0.328%,372573793.00,United States,2004,454372,,
JRS,Nuveen Real Estate Income Fund Common Shares of Beneficial Interest,$9.18,0.04,0.438%,265232884.00,United States,2001,94786,,
JRSH,Jerash Holdings (US) Inc. Common Stock,$6.00,-0.07,-1.153%,67950000.00,United States,2018,5023,Consumer Non-Durables,Apparel
JRVR,James River Group Holdings Ltd. Common Shares,$47.13,-2.19,-4.44%,1442656511.00,Bermuda,2014,236383,Finance,Property-Casualty Insurers
JSD,Nuveen Short Duration Credit Opportunities Fund Common Shares of Beneficial Interest,$13.82,0.12,0.876%,139383655.00,United States,2011,31588,,
JSM,Navient Corporation 6% Senior Notes due December 15 2043,$23.65,-0.33,-1.376%,0.00,United States,,13340,Finance,Finance: Consumer Services
JT,Jianpu Technology Inc. American depositary shares,$3.19,-0.12,-3.625%,67418057.00,,2017,266812,Technology,Computer Software: Programming Data Processing
JTA,Nuveen Tax-Advantaged Total Return Strategy Fund Common Share of Beneficial Interest,$10.09,-0.05,-0.493%,139755551.00,United States,2004,55668,,
JTD,Nuveen Tax-Advantaged Dividend Growth Fund Common Shares of Beneficial Interest,$14.38,-0.04,-0.277%,208284809.00,United States,,73692,,
JULZ,TrueShares Structured Outcome (July) ETF,$29.9193,-0.1748,-0.581%,,United States,2020,2,,
JUPW,Jupiter Wellness Inc. Common Stock,$6.29,-0.54,-7.906%,57756875.00,United States,2020,241487,Consumer Non-Durables,Package Goods/Cosmetics
JUPWW,Jupiter Wellness Inc. Warrant,$1.4123,0.00,0.00%,0.00,United States,2020,16,Consumer Non-Durables,Package Goods/Cosmetics
JVA,Coffee Holding Co. Inc. Common Stock,$4.95,0.25,5.319%,28257565.00,United States,2005,43774,Consumer Non-Durables,Packaged Foods
JW/A,John Wiley & Sons Inc.,$54.41,0.16,0.295%,,United States,,140973,,
JW/B,John Wiley & Sons Inc.,$54.30,1.74,3.311%,,United States,,227,,
JWN,Nordstrom Inc. Common Stock,$37.43,0.39,1.053%,5902094079.00,United States,,4347893,Consumer Services,Clothing/Shoe/Accessory Stores
JWS,Jaws Acquisition Corp. Class A Ordinary Shares,$14.87,0.45,3.121%,1282537500.00,,2020,1308026,Health Care,Medical/Nursing Services
JYAC,Jiya Acquisition Corp. Class A Common Stock,$11.0337,-0.1863,-1.66%,151460041.00,United States,2020,22050,Finance,Business Services
JYNT,The Joint Corp. Common Stock,$38.00,-0.11,-0.289%,533563548.00,United States,2014,124050,Miscellaneous,Multi-Sector Companies
K,Kellogg Company Common Stock,$59.26,1.35,2.331%,20368430958.00,United States,,3517160,Consumer Non-Durables,Packaged Foods
KAI,Kadant Inc Common Stock,$164.00,8.15,5.229%,1887567840.00,United States,,67274,Technology,Industrial Machinery/Components
KAIIU,Kismet Acquisition Two Corp. Unit,$10.2196,-0.0104,-0.102%,0.00,United States,2021,690535,Finance,Business Services
KAIRU,Kairos Acquisition Corp. Unit,$10.66,0.06,0.566%,0.00,United States,2021,35040,Finance,Business Services
KALA,Kala Pharmaceuticals Inc. Common Stock,$9.24,0.22,2.439%,517993153.00,United States,2017,1713791,Health Care,Major Pharmaceuticals
KALU,Kaiser Aluminum Corporation Common Stock,$119.29,3.86,3.344%,1886233640.00,United States,,216042,Capital Goods,Metal Fabrications
KALV,KalVista Pharmaceuticals Inc. Common Stock,$36.25,-2.88,-7.36%,845247268.00,United Kingdom,2015,510615,Health Care,Major Pharmaceuticals
KAMN,Kaman Corporation Common Stock,$56.40,0.55,0.985%,1561004965.00,United States,,244904,Capital Goods,Military/Government/Technical
KAR,KAR Auction Services Inc Common Stock,$14.58,-0.20,-1.353%,1891055218.00,United States,2009,4107783,Consumer Durables,Automotive Aftermarket
KB,KB Financial Group Inc,$38.92,-0.82,-2.063%,15359168318.00,South Korea,,210991,Finance,Commercial Banks
KBAL,Kimball International Inc. Class B Common Stock,$12.61,0.75,6.324%,465080910.00,United States,,658243,Consumer Durables,Home Furnishings
KBH,KB Home Common Stock,$40.50,-1.87,-4.414%,3999864564.00,United States,1986,1299063,Capital Goods,Homebuilding
KBNT,Kubient Inc. Common Stock,$9.81,-1.21,-10.98%,115327429.00,United States,2020,3098979,Technology,EDP Services
KBNTW,Kubient Inc. Warrant,$5.161,-0.339,-6.164%,0.00,United States,2020,51582,Technology,EDP Services
KBR,KBR Inc. Common Stock,$32.00,-0.26,-0.806%,4560865696.00,United States,2006,1640680,Basic Industries,Military/Government/Technical
KBSF,KBS Fashion Group Limited Common Stock,$5.09,0.27,5.602%,13189712.00,China,2013,362064,Consumer Non-Durables,Apparel
KC,Kingsoft Cloud Holdings Limited American Depositary Shares,$60.74,-7.49,-10.978%,13242399107.00,China,2020,1664056,Technology,Computer Software: Prepackaged Software
KCAPL,KCAP Financial Inc. 6.125% Notes due 2022,$25.35,-0.01,-0.039%,0.00,United States,,10350,,
KDMN,Kadmon Holdings Inc. Common Stock,$4.79,-0.26,-5.149%,821547007.00,United States,,5462381,Health Care,Major Pharmaceuticals
KDNY,Chinook Therapeutics Inc. Common Stock,$16.00,0.49,3.159%,674534912.00,United States,2015,93000,Health Care,Major Pharmaceuticals
KDP,Keurig Dr Pepper Inc. Common Stock,$31.68,0.44,1.408%,44581784354.00,United States,,5655763,Consumer Non-Durables,Beverages (Production/Distribution)
KE,Kimball Electronics Inc. Common Stock,$24.64,0.16,0.654%,614941983.00,United States,,136091,Technology,Electrical Products
KELYA,Kelly Services Inc. Class A Common Stock,$20.70,0.33,1.62%,813442932.00,United States,,714126,Technology,Professional Services
KELYB,Kelly Services Inc. Class B Common Stock,$20.81,0.32,1.562%,817765576.00,United States,,752,Technology,Professional Services
KEN,Kenon Holdings Ltd. Ordinary Shares,$30.10,-0.14,-0.463%,1621521886.00,Singapore,2015,2020,Public Utilities,Electric Utilities: Central
KEP,Korea Electric Power Corporation Common Stock,$10.79,0.05,0.466%,13853584782.00,South Korea,1994,321030,Public Utilities,Electric Utilities: Central
KEQU,Kewaunee Scientific Corporation Common Stock,$12.3096,-0.0104,-0.084%,34008926.00,United States,,1216,Capital Goods,Medical Specialities
KERN,Akerna Corp. Common Stock,$6.81,-0.32,-4.488%,95739795.00,United States,2018,1678346,Technology,EDP Services
KERNW,Akerna Corp Warrant,$2.66,-0.11,-3.971%,0.00,United States,2018,62454,Technology,EDP Services
KEX,Kirby Corporation Common Stock,$64.15,3.17,5.198%,3851501850.00,United States,,702295,Consumer Services,Marine Transportation
KEY,KeyCorp Common Stock,$20.49,0.34,1.687%,19993588770.00,United States,,7448279,Finance,Major Banks
KEY^I,KeyCorp Depositary Shares Each Representing a 1/40th Ownership Interest in a Share of Fixed-to-Floating Rate Perpetual Non-Cumulative Preferred Stock Series E,$28.313,0.003,0.011%,,United States,,26701,,
KEY^J,KeyCorp Depositary Shares each representing a 1/40th ownership interest in a share of Fixed Rate Perpetual Non-Cumulative Preferred Stock Series F,$26.51,-0.10,-0.376%,,United States,,17934,,
KEY^K,KeyCorp Depositary Shares each representing a 1/40th ownership interest in a share of Fixed Rate Perpetual Non-Cumulative Preferred Stock Series G,$27.01,-0.02,-0.074%,,United States,,25227,,
KEYS,Keysight Technologies Inc. Common Stock,$137.63,-4.56,-3.207%,25610813176.00,United States,2014,2068705,Capital Goods,Industrial Machinery/Components
KF,Korea Fund Inc. (The) New Common Stock,$43.302,-0.538,-1.227%,217861845.00,United States,,3286,,
KFFB,Kentucky First Federal Bancorp Common Stock,$7.16,-0.03,-0.417%,59028579.00,United States,,5956,Finance,Savings Institutions
KFRC,Kforce Inc. Common Stock,$49.98,0.965,1.969%,1097364778.00,United States,1995,138706,Technology,Professional Services
KFS,Kingsway Financial Services Inc. Common Stock (DE),$4.53,-0.08,-1.735%,102881143.00,Canada,,5790,Finance,Property-Casualty Insurers
KFY,Korn Ferry Common Stock,$61.56,4.97,8.782%,3320417863.00,United States,1999,792460,Technology,Diversified Commercial Services
KGC,Kinross Gold Corporation Common Stock,$6.93,0.39,5.963%,8720712000.00,Canada,,19392257,Basic Industries,Precious Metals
KHC,The Kraft Heinz Company Common Stock,$37.23,-0.25,-0.667%,45538833061.00,United States,,6771415,Consumer Non-Durables,Packaged Foods
KIDS,OrthoPediatrics Corp. Common Stock,$56.52,0.10,0.177%,1105227179.00,United States,2017,227180,Health Care,Medical/Dental Instruments
KIIIU,Kismet Acquisition Three Corp. Unit,$10.18,-0.02,-0.196%,0.00,United States,2021,703169,Finance,Business Services
KIM,Kimco Realty Corporation Common Stock,$18.20,0.53,2.999%,7871841123.00,United States,,9733472,Consumer Services,Real Estate Investment Trusts
KIM^L,Kimco Realty Corporation Class L Depositary Shares each of which represents a one-one thousandth fractional interest in a share of 5.125% Class L Cumulative Redeemable Preferred Stock liquidation preference $25000.00 per share,$25.61,-0.06,-0.234%,,United States,,21191,,
KIM^M,Kimco Realty Corporation Class M Depositary Shares each of which represents a one-one thousandth fractional interest in a share of 5.25% Class M Cumulative Redeemable Preferred Stock liquidation preference $25000.00 per share,$26.07,0.10,0.385%,,United States,,7241,,
KIN,Kindred Biosciences Inc. Common Stock,$4.90,-0.01,-0.204%,193511457.00,United States,2013,314254,Health Care,Major Pharmaceuticals
KINS,Kingstone Companies Inc. Common Stock,$7.27,-0.11,-1.491%,77608689.00,United States,,4159,Finance,Property-Casualty Insurers
KINZ,KINS Technology Group Inc. Class A Common Stock,$10.27,-0.14,-1.345%,354315000.00,United States,2021,358604,Finance,Business Services
KINZU,KINS Technology Group Inc. Unit,$11.02,-0.29,-2.564%,0.00,United States,2020,346278,Finance,Business Services
KINZW,KINS Technology Group Inc. Warrant,$1.64,-0.0599,-3.524%,0.00,United States,2021,264168,Finance,Business Services
KIO,KKR Income Opportunities Fund Common Shares,$15.29,0.08,0.526%,311003416.00,,2013,58192,,
KIQ,Kelso Technologies Inc Ordinary Shares,$1.18,0.03,2.609%,55660701.00,Canada,,4229185,Capital Goods,Railroads
KIRK,Kirkland's Inc. COMMONSTOCK,$27.36,1.16,4.427%,390033107.00,United States,2002,878278,Consumer Services,Other Specialty Stores
KJUL,Innovator Russell 2000 Power Buffer ETF - July,$26.265,-0.0044,-0.017%,,,2020,2317,,
KKR,KKR & Co. Inc. Common Stock,$45.35,-1.42,-3.036%,25980731018.00,United States,,4831676,Finance,Investment Managers
KKR^A,KKR & Co. Inc. 6.75% Series A Preferred Stock,$25.75,0.00,0.00%,,United States,,17404,,
KKR^B,KKR & Co. Inc. 6.50% Series B Preferred Stock,$25.80,0.01,0.039%,,United States,,10233,,
KKR^C,KKR & Co. Inc. 6.00% Series C Mandatory Convertible Preferred Stock,$64.17,-1.71,-2.596%,,United States,,8724,,
KL,Kirkland Lake Gold Ltd. Common Shares,$36.85,1.12,3.135%,9839826182.00,,,1766273,Basic Industries,Precious Metals
KLAC,KLA Corporation Common Stock,$316.16,-14.51,-4.388%,48712241660.00,United States,1980,1123135,Capital Goods,Electronic Components
KLAQU,KL Acquisition Corp Unit,$10.51,-0.03,-0.285%,0.00,United States,2021,184416,Finance,Business Services
KLDO,Kaleido Biosciences Inc. Common Stock,$10.25,-0.42,-3.936%,428792422.00,United States,2019,194140,Health Care,Biotechnology: Biological Products (No Diagnostic Substances)
KLIC,Kulicke and Soffa Industries Inc. Common Stock,$46.80,-2.27,-4.626%,2905202992.00,Singapore,,824175,Technology,Semiconductors
KLR,Kaleyra Inc. Common Stock,$16.60,-0.33,-1.949%,486804645.00,United States,2018,1412712,Technology,EDP Services
KLXE,KLX Energy Services Holdings Inc. Common Stock,$13.93,1.67,13.622%,118545944.00,United States,,174348,Energy,Oilfield Services/Equipment
KMB,Kimberly-Clark Corporation Common Stock,$131.06,0.43,0.329%,44345975879.00,United States,,1786003,Consumer Durables,Containers/Packaging
KMDA,Kamada Ltd. Ordinary Shares,$6.63,-0.12,-1.778%,296645845.00,Israel,2013,152630,Health Care,Major Pharmaceuticals
KMF,Kayne Anderson NextGen Energy & Infrastructure Inc.,$6.39,0.08,1.268%,301591782.00,,2010,431164,,
KMI,Kinder Morgan Inc. Common Stock,$15.17,0.21,1.404%,34351709837.00,United States,2011,13651379,Public Utilities,Natural Gas Distribution
KMPH,KemPharm Inc. Common Stock,$10.45,-0.09,-0.854%,196982322.00,United States,,2934152,Health Care,Major Pharmaceuticals
KMPR,Kemper Corporation,$77.08,2.84,3.825%,5045247120.00,United States,,322473,Finance,Property-Casualty Insurers
KMT,Kennametal Inc. Common Stock,$36.95,0.45,1.233%,3086544461.00,United States,,825906,Capital Goods,Industrial Machinery/Components
KMX,CarMax Inc,$119.38,-1.94,-1.599%,19404198420.00,United States,,751271,Consumer Durables,Automotive Aftermarket
KN,Knowles Corporation Common Stock,$21.13,0.08,0.38%,1938178304.00,,2014,680732,Consumer Non-Durables,Consumer Electronics/Appliances
KNDI,Kandi Technologies Group Inc Common Stock,$7.76,-0.45,-5.481%,561649827.00,China,,4176261,Capital Goods,Auto Manufacturing
KNGS,UPHOLDINGS Compound Kings ETF,$28.1483,-0.3188,-1.12%,,United States,2020,5363,,
KNL,Knoll Inc. Common Stock,$16.70,0.96,6.099%,846390285.00,United States,2004,173522,Consumer Durables,Office Equipment/Supplies/Services
KNOP,KNOT Offshore Partners LP Common Units representing Limited Partner Interests,$16.90,-0.07,-0.412%,552530189.00,United Kingdom,2013,149303,Consumer Services,Marine Transportation
KNSA,Kiniksa Pharmaceuticals Ltd. Class A Common Stock,$23.34,-0.63,-2.628%,1588871317.00,United States,2018,393148,Health Care,Major Pharmaceuticals
KNSL,Kinsale Capital Group Inc. Common Stock,$175.95,-3.87,-2.152%,3990032754.00,United States,2016,260747,Finance,Property-Casualty Insurers
KNTE,Kinnate Biopharma Inc. Common Stock,$32.43,-0.17,-0.521%,1405101712.00,United States,2020,105873,Health Care,Major Pharmaceuticals
KNX,Knight-Swift Transportation Holdings Inc.,$43.37,-0.75,-1.70%,7365593760.00,United States,2017,1220808,Transportation,Trucking Freight/Courier Services
KO,Coca-Cola Company (The) Common Stock,$50.63,0.52,1.038%,217810260000.00,United States,,14370879,Consumer Non-Durables,Beverages (Production/Distribution)
KOD,Kodiak Sciences Inc Common Stock,$122.61,-8.83,-6.718%,6225604776.00,United States,2018,372489,Health Care,Biotechnology: Biological Products (No Diagnostic Substances)
KODK,Eastman Kodak Company Common New,$9.06,-0.28,-2.998%,699099734.00,United States,,3390908,Miscellaneous,Industrial Machinery/Components
KOF,Coca Cola Femsa S.A.B. de C.V.  American Depositary Shares each representing 10 Units (each Unit consists of 3 Series B Shares and 5 Series L Shares),$44.12,-1.07,-2.368%,9268871931.00,Mexico,1993,161487,Consumer Non-Durables,Beverages (Production/Distribution)
KOP,Koppers Holdings Inc. Koppers Holdings Inc. Common Stock,$37.25,1.25,3.472%,784686783.00,United States,2006,143672,Basic Industries,Forest Products
KOPN,Kopin Corporation Common Stock,$10.74,-1.11,-9.367%,913469650.00,United States,1992,6679684,Technology,Semiconductors
KOR,Corvus Gold Inc. Common Shares,$2.25,0.045,2.041%,284923901.00,Canada,,153234,Basic Industries,Precious Metals
KOS,Kosmos Energy Ltd. Common Shares (DE),$2.82,0.08,2.92%,1143383235.00,Bermuda,2011,13488423,Energy,Oil & Gas Production
KOSS,Koss Corporation Common Stock,$13.31,-0.74,-5.267%,111742415.00,United States,,1520392,Consumer Non-Durables,Consumer Electronics/Appliances
KPTI,Karyopharm Therapeutics Inc. Common Stock,$14.92,-0.19,-1.257%,1102931160.00,United States,2013,2981567,Health Care,Major Pharmaceuticals
KR,Kroger Company (The) Common Stock,$33.59,-0.43,-1.264%,25573647745.00,United States,,7199198,Consumer Services,Food Chains
KRA,Kraton Corporation Common Stock,$42.90,2.83,7.063%,1367304296.00,United States,2009,302868,Basic Industries,Major Chemicals
KRBP,Kiromic BioPharma Inc. Common Stock,$10.90,-0.16,-1.447%,79929689.00,United States,2020,71975,Health Care,Biotechnology: Biological Products (No Diagnostic Substances)
KRC,Kilroy Realty Corporation Common Stock,$59.91,1.93,3.329%,6971672541.00,United States,1997,610464,Consumer Services,Real Estate Investment Trusts
KREF,KKR Real Estate Finance Trust Inc. Common Stock,$18.50,-0.04,-0.216%,1028959418.00,United States,2017,212421,Consumer Services,Real Estate Investment Trusts
KRG,Kite Realty Group Trust Common Stock,$19.10,0.75,4.087%,1607990781.00,United States,2004,386384,Consumer Services,Real Estate Investment Trusts
KRKR,36Kr Holdings Inc. American Depositary Shares,$5.85,0.85,17.00%,219341889.00,China,2019,2354847,Miscellaneous,Business Services
KRMD,Repro Med Systems Inc. Common Stock,$4.33,-0.02,-0.46%,190272705.00,United States,,477237,Health Care,Medical/Dental Instruments
KRNLU,Kernel Group Holdings Inc. Units,$10.45,-0.03,-0.286%,0.00,United States,2021,33464,Finance,Business Services
KRNT,Kornit Digital Ltd. Ordinary Shares,$118.67,-0.74,-0.62%,5373131716.00,Israel,2015,383112,Capital Goods,Industrial Machinery/Components
KRNY,Kearny Financial Corp Common Stock,$11.23,0.21,1.906%,945568931.00,United States,,415027,Finance,Savings Institutions
KRO,Kronos Worldwide Inc Common Stock,$14.62,0.15,1.037%,1689234523.00,United States,,165766,Basic Industries,Major Chemicals
KRON,Kronos Bio Inc. Common Stock,$27.72,-0.59,-2.084%,1553248731.00,United States,2020,57437,Health Care,Major Pharmaceuticals
KROS,Keros Therapeutics Inc. Common Stock,$64.96,-1.68,-2.521%,1505665681.00,United States,2020,87230,Health Care,Major Pharmaceuticals
KRP,Kimbell Royalty Partners Common Units Representing Limited Partner Interests,$9.84,0.11,1.131%,591208435.00,United States,2017,250336,Energy,Oil & Gas Production
KRTX,Karuna Therapeutics Inc. Common Stock,$128.99,4.22,3.382%,3457778948.00,United States,2019,147302,Health Care,Major Pharmaceuticals
KRUS,Kura Sushi USA Inc. Class A Common Stock,$28.99,1.85,6.817%,242695177.00,United States,2019,94475,Consumer Services,Restaurants
KRYS,Krystal Biotech Inc. Common Stock,$76.93,-0.05,-0.065%,1706434950.00,United States,2017,101647,Health Care,Biotechnology: Biological Products (No Diagnostic Substances)
KSM,DWS Strategic Municipal Income Trust,$11.59,-0.22,-1.863%,129853676.00,United States,1989,15895,,
KSMT,Kismet Acquisition One Corp Ordinary Shares,$10.07,-0.02,-0.198%,319722500.00,Russia,2020,315098,Finance,Business Services
KSMTU,Kismet Acquisition One Corp Unit,$10.64,-0.06,-0.561%,0.00,Russia,2020,7472,Finance,Business Services
KSMTW,Kismet Acquisition One Corp Warrant,$1.20,-0.06,-4.762%,0.00,Russia,,317006,Finance,Business Services
KSPN,Kaspien Holdings Inc. Common Stock,$31.92,-0.08,-0.25%,61483857.00,United States,,9325,Consumer Services,Consumer Electronics/Video Chains
KSS,Kohl's Corporation Common Stock,$55.97,3.27,6.205%,8823804548.00,United States,1992,13035916,Consumer Services,Department/Specialty Retail Stores
KSU,Kansas City Southern Common Stock,$213.70,1.11,0.522%,19414184904.00,United States,,531450,Transportation,Railroads
KSU^,Kansas City Southern Preferred Stock,$38.10,0.00,0.00%,,United States,,6,Transportation,Railroads
KT,KT Corporation Common Stock,$11.39,-0.36,-3.064%,5417050832.00,South Korea,,1311351,Public Utilities,Telecommunications Equipment
KTB,Kontoor Brands Inc. Common Stock ,$44.10,0.69,1.589%,2522756817.00,,2019,528858,Consumer Non-Durables,Apparel
KTCC,Key Tronic Corporation Common Stock,$7.86,-0.10,-1.256%,84571085.00,United States,1983,40890,Technology,Electrical Products
KTF,DWS Municipal Income Trust,$11.35,-0.10,-0.873%,448335646.00,United States,1988,122367,,
KTH,Structures Products Cp 8% CorTS Issued by Peco Energy Cap Tr II Preferred Stock,$33.62,-0.08,-0.237%,0.00,United States,,312,Finance,Finance: Consumer Services
KTN,Structured Products Corp 8.205% CorTS 8.205% Corporate Backed Trust Securities (CorTS),$32.8915,0.2415,0.74%,0.00,United States,,333,Finance,Finance: Consumer Services
KTOS,Kratos Defense & Security Solutions Inc. Common Stock,$30.50,0.25,0.826%,3744061904.00,United States,,1300512,Capital Goods,Military/Government/Technical
KTRA,Kintara Therapeutics Inc. Common Stock,$2.39,0.08,3.463%,73196183.00,United States,,1033319,Health Care,Major Pharmaceuticals
KUKE,Kuke Music Holding Limited American Depositary Shares each representing one Ordinary Share,$8.63,0.06,0.70%,255160819.00,,2021,36526,Consumer Services,Other Consumer Services
KURA,Kura Oncology Inc. Common Stock,$33.04,-0.77,-2.277%,2181782821.00,United States,,560819,Health Care,Major Pharmaceuticals
KVHI,KVH Industries Inc. Common Stock,$14.27,0.08,0.564%,261178944.00,United States,1996,72759,Technology,Radio And Television Broadcasting And Communications Equipment
KW,Kennedy-Wilson Holdings Inc. Common Stock,$18.18,0.57,3.237%,2576644092.00,United States,,326584,Finance,Real Estate
KWAC,Kingswood Acquisition Corp. Class A Common Stock,$10.195,-0.005,-0.049%,117242500.00,,2021,840533,Finance,Business Services
KWR,Quaker Chemical Corporation Common Stock,$298.34,3.64,1.235%,5319872384.00,United States,,72539,Basic Industries,Major Chemicals
KXIN,Kaixin Auto Holdings Ordinary Share,$4.23,0.05,1.196%,275508990.00,China,2017,4547690,Consumer Durables,Automotive Aftermarket
KYMR,Kymera Therapeutics Inc. Common Stock,$52.21,-2.47,-4.517%,2321201310.00,United States,2020,288060,Health Care,Biotechnology: Biological Products (No Diagnostic Substances)
KYN,Kayne Anderson Energy Infrastructure Fund Inc.,$7.13,0.21,3.035%,901571060.00,United States,2004,878707,,
KZIA,Kazia Therapeutics Limited American Depositary Shares,$11.94,0.24,2.051%,112980292.00,Australia,,571866,Health Care,Major Pharmaceuticals
KZR,Kezar Life Sciences Inc. Common Stock,$5.80,-0.24,-3.974%,269120000.00,United States,2018,123245,Health Care,Major Pharmaceuticals
L,Loews Corporation Common Stock,$49.48,1.42,2.955%,13213463690.00,United States,,1557716,Finance,Property-Casualty Insurers
LABP,Landos Biopharma Inc. Common Stock,$14.24,-0.26,-1.793%,557683598.00,United States,2021,183039,Health Care,Major Pharmaceuticals
LAC,Lithium Americas Corp. Common Shares,$19.82,-1.21,-5.754%,2365985842.00,Canada,,3966737,Basic Industries,Precious Metals
LACQ,Leisure Acquisition Corp. Common Stock,$14.54,-0.535,-3.549%,90500857.00,United States,2017,3495,Finance,Business Services
LACQW,Leisure Acquisition Corp. Warrant,$1.72,-0.12,-6.522%,0.00,United States,2017,63548,Finance,Business Services
LAD,Lithia Motors Inc. Common Stock,$370.74,-9.95,-2.614%,9833615645.00,United States,,195255,Consumer Durables,Automotive Aftermarket
LADR,Ladder Capital Corp Class A Common Stock,$10.92,0.08,0.738%,1357000630.00,,2014,950805,Consumer Services,Real Estate Investment Trusts
LAIX,LAIX Inc. American Depositary Shares each  representing one Class A Ordinary Share,$3.39,-0.14,-3.966%,167507470.00,,2018,1126952,Consumer Services,Other Consumer Services
LAKE,Lakeland Industries Inc. Common Stock,$33.24,-2.06,-5.836%,266584135.00,United States,1986,327201,Health Care,Industrial Specialties
LAMR,Lamar Advertising Company Class A Common Stock,$87.56,2.23,2.613%,8830255433.00,United States,1996,554593,Consumer Services,Real Estate Investment Trusts
LANC,Lancaster Colony Corporation Common Stock,$176.47,-2.00,-1.121%,4861572030.00,United States,,63831,Consumer Non-Durables,Packaged Foods
LAND,Gladstone Land Corporation Common Stock,$18.06,-0.10,-0.551%,435289452.00,United States,2013,247715,Consumer Services,Real Estate Investment Trusts
